{
  "event_id": "session:S1:M1:2",
  "kind": "SESSION_FROZEN",
  "occurred_at": "2026-09-23T09:10:00+08:00",
  "subject_id": "session:S1:M1",
  "version": 2,
  "command_id": "freeze-S1-M1",
  "actor_id": "manager-1",
  "data": {
    "venue_confirmed": true,
    "staff": ["staff-1"],
    "referees": ["ref-1"],
    "emergency_plan_id": "EP-2026-09-23",
    "guardian_station": true
  }
}
